{"id":"things-at-home","name":"Things at home","enabled":true,"answers":[{"name":"Chair","aliases":["chairs"]},{"name":"Table","aliases":["tables"]},{"name":"Sofa","aliases":["couch"]},{"name":"Cup","aliases":["cups"]},{"name":"Book","aliases":["books"]},{"name":"Lamp","aliases":["lamps"]},{"name":"Bed","aliases":["beds"]},{"name":"Door","aliases":["doors"]},{"name":"Clock","aliases":["clocks"]},{"name":"Teddy bear","aliases":["teddy","bear"]}]}
