{"id":"countries","name":"Countries","enabled":true,"answers":[{"name":"United Kingdom","aliases":["UK","Britain"]},{"name":"France","aliases":[]},{"name":"Italy","aliases":[]},{"name":"Spain","aliases":[]},{"name":"Japan","aliases":[]},{"name":"Australia","aliases":[]},{"name":"Canada","aliases":[]},{"name":"India","aliases":[]}]}
