{"id":"dinosaurs","name":"Dinosaurs","enabled":true,"answers":[{"name":"Tyrannosaurus rex","aliases":["T Rex","T-Rex"]},{"name":"Triceratops","aliases":[]},{"name":"Stegosaurus","aliases":[]},{"name":"Brachiosaurus","aliases":[]},{"name":"Velociraptor","aliases":[]},{"name":"Diplodocus","aliases":[]}]}
