{"id":"fruits","name":"Fruits","enabled":true,"answers":[{"name":"Apple","aliases":["apples"]},{"name":"Banana","aliases":["bananas"]},{"name":"Orange","aliases":["oranges"]},{"name":"Strawberry","aliases":["strawberries"]},{"name":"Mango","aliases":["mangoes"]},{"name":"Pear","aliases":["pears"]},{"name":"Blueberry","aliases":["blueberries"]},{"name":"Grapes","aliases":["grape"]},{"name":"Lemon","aliases":["lemons"]},{"name":"Watermelon","aliases":["watermelons"]}]}
