{"id":"vegetables","name":"Vegetables","enabled":true,"answers":[{"name":"Carrot","aliases":["carrots"]},{"name":"Potato","aliases":["potatoes"]},{"name":"Pea","aliases":["peas"]},{"name":"Broccoli","aliases":[]},{"name":"Cucumber","aliases":["cucumbers"]},{"name":"Tomato","aliases":["tomatoes"]},{"name":"Onion","aliases":["onions"]},{"name":"Pepper","aliases":["peppers"]},{"name":"Sweetcorn","aliases":["corn"]},{"name":"Lettuce","aliases":[]}]}
