{"id":"colours","name":"Colours","enabled":true,"answers":[{"name":"Red","aliases":[]},{"name":"Blue","aliases":[]},{"name":"Yellow","aliases":[]},{"name":"Green","aliases":[]},{"name":"Orange","aliases":[]},{"name":"Purple","aliases":[]},{"name":"Pink","aliases":[]},{"name":"Brown","aliases":[]},{"name":"Black","aliases":[]},{"name":"White","aliases":[]}]}
